{
  "decisionsVersion": "1.0",
  "modelName": "Active2021Q3DealerBuyingEvent",
  "tableStrategy": "single-flat",
  "tables": [
    {
      "name": "Sheet1 (Launch Data)",
      "role": "fact",
      "sourceType": "csv",
      "sourceFile": "C:\\Users\\BoghraJeelKishorbhai\\Deterministic-Agentic\\Data\\Q3 Buyer\\Q3LaunchData 1.csv",
      "keyColumns": []
    },
    {
      "name": "Rank Sort Measure",
      "role": "param",
      "datatable": {
        "columns": [
          { "name": "Rank Sort Measure", "dataType": "string", "type": "string" }
        ],
        "rows": [
          ["Order $ (Decending)"],
          ["Order Units (Decending)"],
          ["Order $ (Accending)"],
          ["Order Units (Accending)"]
        ]
      }
    },
    {
      "name": "Rows Displayed",
      "role": "param",
      "datatable": {
        "columns": [
          { "name": "Rows Displayed", "dataType": "string", "type": "string" }
        ],
        "rows": [
          ["5"],
          ["10"],
          ["20"],
          ["50"],
          ["10000"]
        ]
      }
    }
  ],
  "relationships": [],
  "measures": [
    {
      "table": "Sheet1 (Launch Data)",
      "name": "Total Order $",
      "dax": "SUM ( 'Sheet1 (Launch Data)'[Order $ (USD)] )",
      "formatString": "\\$#,0",
      "displayFolder": "Base Measures",
      "description": "Total dealer order dollars.",
      "source": "llm"
    },
    {
      "table": "Sheet1 (Launch Data)",
      "name": "Total Order Quantity",
      "dax": "SUM ( 'Sheet1 (Launch Data)'[Order Quantity] )",
      "formatString": "#,0",
      "displayFolder": "Base Measures",
      "description": "Total order units.",
      "source": "llm"
    },
    {
      "table": "Sheet1 (Launch Data)",
      "name": "Distinct Style Count",
      "dax": "DISTINCTCOUNT ( 'Sheet1 (Launch Data)'[Style Code] )",
      "formatString": "#,0",
      "displayFolder": "Base Measures",
      "description": "Distinct count of styles.",
      "source": "llm"
    },
    {
      "table": "Sheet1 (Launch Data)",
      "name": "Rank Sort Value",
      "dax": "SWITCH (\n    SELECTEDVALUE ( 'Rank Sort Measure'[Rank Sort Measure], \"Order $ (Decending)\" ),\n    \"Order $ (Accending)\", - SUM ( 'Sheet1 (Launch Data)'[Order $ (USD)] ),\n    \"Order Units (Accending)\", - SUM ( 'Sheet1 (Launch Data)'[Order Quantity] ),\n    \"Order $ (Decending)\", SUM ( 'Sheet1 (Launch Data)'[Order $ (USD)] ),\n    \"Order Units (Decending)\", SUM ( 'Sheet1 (Launch Data)'[Order Quantity] )\n)",
      "formatString": "#,0",
      "displayFolder": "Ranking",
      "description": "Sort driver chosen by the Rank Sort Measure parameter; sign flips for ascending so a descending rank always orders correctly.",
      "source": "llm"
    },
    {
      "table": "Sheet1 (Launch Data)",
      "name": "Rank",
      "dax": "RANKX (\n    ALLSELECTED ( 'Sheet1 (Launch Data)'[Style Code] ),\n    [Rank Sort Value],\n    ,\n    DESC,\n    Dense\n)",
      "formatString": "0",
      "displayFolder": "Ranking",
      "description": "Style rank by the parameter-driven sort measure (Tableau RANK table calc).",
      "source": "llm"
    },
    {
      "table": "Sheet1 (Launch Data)",
      "name": "Rank (Order $)",
      "dax": "RANKX (\n    ALLSELECTED ( 'Sheet1 (Launch Data)'[Style Code] ),\n    [Total Order $],\n    ,\n    DESC,\n    Dense\n)",
      "formatString": "0",
      "displayFolder": "Ranking",
      "description": "Style rank by total order dollars (Tableau RANK(SUM([Order $]))).",
      "source": "llm"
    },
    {
      "table": "Sheet1 (Launch Data)",
      "name": "Order $ (Percent of Total)",
      "dax": "DIVIDE (\n    [Total Order $],\n    CALCULATE ( [Total Order $], ALLSELECTED ( 'Sheet1 (Launch Data)' ) )\n)",
      "formatString": "0.0%",
      "displayFolder": "Ratios",
      "description": "Order dollars as a percent of the visible total (Tableau SUM([Order $]) / TOTAL(SUM([Order $]))).",
      "source": "llm"
    },
    {
      "table": "Sheet1 (Launch Data)",
      "name": "Calculation3",
      "dax": "DIVIDE (\n    [Total Order $],\n    CALCULATE ( [Total Order $], ALLSELECTED ( 'Sheet1 (Launch Data)' ) )\n)",
      "formatString": "0.0%",
      "displayFolder": "Ratios",
      "description": "Duplicate of Order $ (Percent of Total) from the Tableau workbook.",
      "source": "llm"
    }
  ],
  "visualDecisions": []
}
